<?xml version="1.0" encoding="UTF-8"?>
<!DOCTYPE app-routes SYSTEM "../../../PHPBackend/config.dtd" >
<app-routes>

	<module name="Account">
	 	<route action="index" urlPattern="/member/"/>
	 	<route action="downlines" urlPattern="/member/downlines/"/>
	 	<route action="downlines" urlPattern="/member/downlines/(left|right|middle|all)\.html" paramsNames="foot"/>
	 	<route action="downlines" urlPattern="/member/downlines/(sponsorized)\.html" paramsNames="option"/>
	 	
	 	<route action="tree" urlPattern="/member/tree/"/>
	 	<route action="tree" urlPattern="/member/tree/(left|right|middle|all)\.(json|html)" paramsNames="foot,ext"/>
	 	<route action="tree" urlPattern="/member/tree/(left|right|middle|all)-(stack|tree)\.(json|html)" paramsNames="foot,affichage,ext"/>
	 	
	 	<route action="withdrawals" urlPattern="/member/withdrawals/"/>
	 	<route action="newWithdrawal" urlPattern="/member/withdrawals/new\.html"/>
	 	<route action="updateWithdrawal" urlPattern="/member/withdrawals/([0-9]+)/update\.html" paramsNames="id"/>
	 	<route action="history" urlPattern="/member/history/"/>
		<route action="history" urlPattern="/member/history/([0-9]{1,2})-([0-9]{4})\.html" paramsNames="month,year"/>
		<route action="history" urlPattern="/member/history/([0-9]{1,2})-([0-9]{1,2})-([0-9]{4})\.html" paramsNames="day,month,year"/>
	 	
	 	<route action="sellSheet" urlPattern="/member/sell-sheet/"/>
	 	<route action="sellSheet" urlPattern="/member/sell-sheet/([0-9]+)-([0-9]+)\.html" paramsNames="limit,offset"/>
	</module>
	
	<module name="Profil">
	 	<route action="index" urlPattern="/member/profil/"/>
	 	<route action="update" urlPattern="/member/profil/"/>
	 	
	 	<route action="password" urlPattern="/member/profil/password\.html"/>
	 	<route action="photo" urlPattern="/member/profil/photo\.html"/>
	 	<route action="address" urlPattern="/member/profil/address\.html"/>
	</module>
	
	<module name="MyOffice"><!-- monitoring de l'office -->
	 	<route action="index" urlPattern="/member/office/"/>
	 	<route action="withdrawals" urlPattern="/member/office/withdrawals/"/>
	 	<route action="withdrawals" urlPattern="/member/office/withdrawals/([0-9]+)-([0-9]+)\.html" paramsNames="limit,offset"/>
	 	<route action="members" urlPattern="/member/office/members/"/>
	 	<route action="upgrades" urlPattern="/member/office/upgrades\.html"/>
	 	<route action="members" urlPattern="/member/office/members/(table|grid)/" paramsNames="affichage"/>
	 	<route action="members" urlPattern="/member/office/members/(table|grid)/([0-9]+)-([0-9]+)\.html" paramsNames="affichage,limit,offset"/>
	 	<route action="virtualmoney" urlPattern="/member/office/virtualmoney/"/>
	 	<route action="sendRaportWithdrawals" urlPattern="/member/office/send-matched-money.html"/>
	 	<route action="requestVirtualmoney" urlPattern="/member/office/virtualmoney/request\.html"/>
	 	<route action="history" urlPattern="/member/office/history/"/>
		<route action="history" urlPattern="/member/office/history/([0-9]{1,2}-[0-9]{1,2}-[0-9]{4})\.html" paramsNames="date"/>
		<route action="history" urlPattern="/member/office/history/([0-9]{1,2})-([0-9]{4})\.html" paramsNames="month,year"/>
	 	<route action="index" urlPattern="/member/office/"/>
	</module>
	 	
</app-routes>
