<?xml version="1.0" encoding="UTF-8"?>
<!DOCTYPE app-routes SYSTEM "../../../PHPBackend/config.dtd" >

<app-routes>
	<module name="Dashboard">
	 	<route action="index" urlPattern="/office/"/>
	 	<route action="virtualMoney" urlPattern="/office/virtualmoney/"/>
	 	<route action="requestVirtualMoney" urlPattern="/office/virtualmoney/request\.html"/>
	</module>
	 
	<module name="Profil">
	 	<route action="index" urlPattern="/office/profil/"/>
	 	<route action="photo" urlPattern="/office/profil/photo\.html"/>
	 	<route action="password" urlPattern="/office/profil/password\.html"/>
	 	<route action="address" urlPattern="/office/profil/address\.html"/>
	</module>

	<module name="Members">
	 	<route action="index" urlPattern="/office/members/"/>
	 	<route action="index" urlPattern="/office/members/(table|grid)/" paramsNames="affichage"/>
	 	<route action="index" urlPattern="/office/members/([0-9]+)-([0-9]+)\.html" paramsNames="limit,offset"/>
	 	<route action="index" urlPattern="/office/members/(table|grid)/([0-9]+)-([0-9]+)\.html" paramsNames="affichage,limit,offset"/>
	 	<route action="addMember" urlPattern="/office/members/add\.html"/>
	 	
	 	<route action="member" urlPattern="/office/members/([0-9]+)/" paramsNames="id"/>
	 	<route action="upgradeMember" urlPattern="/office/members/([0-9]+)/(upgrade)\.html" paramsNames="id,option"/>
	 	<route action="downlines" urlPattern="/office/members/([0-9]+)/(downlines)/" paramsNames="id,option"/>
	 	<route action="downlines" urlPattern="/office/members/([0-9]+)/(downlines)/(left|middle|right|all)\.html" paramsNames="id,option,foot"/>
	
		<route action="withdrawalsMember" urlPattern="/office/members/([0-9]+)/(withdrawals)\.html" paramsNames="id,option"/>
		<route action="withdrawalsMember" urlPattern="/office/members/([0-9]+)/(withdrawals)/([0-9]+)\.html" paramsNames="id,option,requestId"/>
	</module>
	
	<module name="Products">
		<route action="index" urlPattern="/office/products/"/>
	</module>
</app-routes>
