<?xml version="1.0" encoding="UTF-8"?>
<!DOCTYPE app-routes SYSTEM "../../../PHPBackend/config.dtd" >

<app-routes>
	<module name="Dashboard">
	 	<route action="index" urlPattern="/office/"/>
	 	<route action="virtualMoney" urlPattern="/office/virtualmoney/"/>
	 	<route action="requestVirtualMoney" urlPattern="/office/virtualmoney/request\.html"/>
		<route action="virtualMoneyHistory" urlPattern="/office/virtualmoney/history\.html"/>
		<route action="virtualMoneyHistory" urlPattern="/office/virtualmoney/(\d{1,2}-\d{1,2}-\d{4})\.html" paramsNames="date"/>
		<route action="virtualMoneyHistory" urlPattern="/office/virtualmoney/(\d{1,2})-(\d{4})\.html" paramsNames="monthIndex,yearIndex"/>
	</module>
	 
	<module name="Profil">
	 	<route action="index" urlPattern="/office/profil/"/>
	 	<route action="photo" urlPattern="/office/profil/photo\.html"/>
	 	<route action="password" urlPattern="/office/profil/password\.html"/>
	 	<route action="address" urlPattern="/office/profil/address\.html"/>
	</module>

	<module name="Members">
	 	<route action="index" urlPattern="/office/members/"/>
	 	<route action="index" urlPattern="/office/members/(table|grid)/" paramsNames="affichage"/>
	 	<route action="index" urlPattern="/office/members/([0-9]+)-([0-9]+)\.html" paramsNames="limit,offset"/>
	 	<route action="index" urlPattern="/office/members/(table|grid)/([0-9]+)-([0-9]+)\.html" paramsNames="affichage,limit,offset"/>
	 	<route action="addMember" urlPattern="/office/members/add\.html"/>
	 	
	 	<route action="member" urlPattern="/office/members/([0-9]+)/" paramsNames="id"/>
	 	<route action="upgradeMember" urlPattern="/office/members/([0-9]+)/(upgrade)\.html" paramsNames="id,option"/>
	 	<route action="downlines" urlPattern="/office/members/([0-9]+)/(downlines)/" paramsNames="id,option"/>
	 	<route action="downlines" urlPattern="/office/members/([0-9]+)/(downlines)/(left|middle|right|all)\.html" paramsNames="id,option,foot"/>
	
	 	<route action="sellSheet" urlPattern="/office/members/([0-9]+)/(sell-sheet)/" paramsNames="id,option"/>
	 	<route action="addSellSheetRow" urlPattern="/office/members/([0-9]+)/(sell-sheet)/add\.html" paramsNames="id,option"/>
	 	<!-- afficliation d'un membre. pour un compte ayant des points valeur-->
		<route action="affiliateMember" urlPattern="/office/members/([0-9]+)/(affiliate)\.html" paramsNames="id,option"/>
	 	<!-- upgrade d'un compte membre. soit du proprietaire des point valeurs, soit d'un autre membre -->
		<route action="pvUpgradeMember" urlPattern="/office/members/([0-9]+)/pv-upgrade\.html" paramsNames="id"/>

		<route action="withdrawalsMember" urlPattern="/office/members/([0-9]+)/(withdrawals)\.html" paramsNames="id,option"/>
		<route action="withdrawalsMember" urlPattern="/office/members/([0-9]+)/(withdrawals)/([0-9]+)\.html" paramsNames="id,option,requestId"/>
	</module>
	
	<module name="Products">
		<!-- select commands of date -->
		<route action="index" urlPattern="/office/products/"/>
		<route action="index" urlPattern="/office/products/commands-of-([0-9]{1,2}-[0-9]{1,2}-[0-9]{4})/" paramsNames="date"/>
		<route action="index" urlPattern="/office/products/commands-of-([0-9]{1,2}-[0-9]{1,2}-[0-9]{4})/([0-9]+)-([0-9]+)\.html" paramsNames="date,limit,offset"/>
		<!-- // -->
		
		<!-- select commands of month -->
		<route action="index" urlPattern="/office/products/commands-of-([0-9]{1,2})-([0-9]{4})/" paramsNames="month,year"/>
		<route action="index" urlPattern="/office/products/commands-of-([0-9]{1,2})-([0-9]{4})/([0-9]+)-([0-9]+)\.html" paramsNames="month,year,limit,offset"/>
		<!-- // -->
		
		<!-- select commands of week -->
		<route action="index" urlPattern="/office/products/commands-of-([0-9]{1,2}-[0-9]{1,2}-[0-9]{4})-to-([0-9]{1,2}-[0-9]{1,2}-[0-9]{4})-week-([0-5])/" paramsNames="firstDay,lastDay,week"/>
		<route action="index" urlPattern="/office/products/commands-of-([0-9]{1,2}-[0-9]{1,2}-[0-9]{4})-to-([0-9]{1,2}-[0-9]{1,2}-[0-9]{4})-week-([0-5])/([0-9]+)-([0-9]+)\.html" paramsNames="firstDay,lastDay,week,limit,offset"/>
		<!-- // -->
		
		<route action="products" urlPattern="/office/products/vailable/"/>
		
		<route action="command" urlPattern="/office/products/command/"/>
		<route action="command" urlPattern="/office/products/command/pdf\.pdf"/>
		<route action="command" urlPattern="/office/products/commands/([0-9]+)/(pdf)\.pdf" paramsNames="id,option"/>
		<route action="command" urlPattern="/office/products/commands/([0-9]+)/(delivered)\.html" paramsNames="id,option"/>
		
		<route action="validateCommand" urlPattern="/office/products/command/validate\.html"/>
		<route action="cancelCommand" urlPattern="/office/products/command/cancel\.html"/>
		<route action="memberCommand" urlPattern="/office/products/command/member\.html"/>
		<route action="productCommand" urlPattern="/office/products/command/product\.html"/>
		
		<!-- to manage member file content monthly bonus -->
		<route action="purchase" urlPattern="/office/products/purchase/"/>
		<route action="purchase" urlPattern="/office/products/purchase/([0-9]+)-([0-9]+)\.html" paramsNames="limit,offset"/>
		<route action="addPurchase" urlPattern="/office/products/purchase/add\.html"/>
		<!-- // -->
	</module>
</app-routes>
